{
  "schema": "interal-v5-contract/1",
  "namespace": "research-v5",
  "git_commit": "943376263509601473ba8aa568762daa10b5aaed",
  "uncommitted_source_files": [],
  "declared_schema_versions": {
    "importers": [
      "isolated-morphology-import/1.0.2",
      "morphology-import-record/1"
    ],
    "normative": [],
    "baseline": [
      "v5-baseline-1.0.0"
    ],
    "history": [
      "interal-history/1"
    ],
    "adapter": [
      "mass-proposed-annotation-snapshot/1",
      "v5-external-row-index/1",
      "v5-modern-bridge-exercise/1",
      "v5-projection-integrity/1",
      "v5-research-adapter/1",
      "v5-review-projection/1"
    ],
    "diagnostics": [
      "v5-complete-patterns/1",
      "v5-configured-tail-exposure/1",
      "v5-diagnostic-artifacts/1",
      "v5-diagnostic-backup-restore/1",
      "v5-diagnostic-backup/1",
      "v5-diagnostic-coverage/1",
      "v5-diagnostic-priority-queues/1",
      "v5-diagnostic-review-economy/1",
      "v5-diagnostics-independent-replay/1",
      "v5-direct-membership-flags/1",
      "v5-global-diagnostics/1",
      "v5-lexical-diagnostic-coverage/1",
      "v5-mechanism-cohorts/1",
      "v5-provenance-distribution/1"
    ],
    "structural": [
      "v5-structural-certification/1",
      "v5-structural-independent-validation/1",
      "v5-structural-metadata-audit/1",
      "v5-structural-run/2",
      "v5-structural-scan/1",
      "v5-structural-shadow/1",
      "v5-structural-snapshot/1"
    ],
    "surface": [
      "v5-historical-surface-catalog/1",
      "v5-surface-proof/1"
    ],
    "morphology": [
      "v5-morphology-review/1"
    ],
    "morphology_review": [
      "v5-morphology-semantic-review/2"
    ],
    "national": [
      "interal-correspondence-proposal-audit/1",
      "interal-national-correspondences/1"
    ],
    "semantic": [
      "interal-semantic-case/1",
      "interal-semantic-history-scope/1",
      "interal-semantic-native-lookup/1",
      "interal-semantic-scope/1",
      "semantic-review-release/1"
    ],
    "boundary": [
      "boundary-archive-parts/2",
      "boundary-audit/2",
      "boundary-backup/2",
      "boundary-certified-source-restore/2",
      "boundary-context/2",
      "boundary-coverage/2",
      "boundary-detailed-contexts/2",
      "boundary-independent-replay/2",
      "boundary-release/2",
      "boundary-source-index/2"
    ],
    "quality": [
      "blind-historical-contexts/1",
      "cleanup-frozen-gold/1",
      "cleanup-old-study-compatibility/1",
      "cleanup-operation-admission/1",
      "cleanup-probability-design/1",
      "cleanup-quality-bundle/1",
      "cleanup-quality-evaluation/1",
      "cleanup-quality-independent-verification/1",
      "cleanup-quality-metrics/1",
      "cleanup-quality-packets/1",
      "cleanup-quality-research-bundle/1"
    ],
    "dry_run": [
      "full-v5-cleanup-dry-run/1",
      "full-v5-copy-completion/2",
      "full-v5-dry-run-inputs/1",
      "full-v5-shadow-layer/1",
      "full-v5-shadow-plan/1"
    ],
    "release": [
      "controlled-family-release/1",
      "controlled-mass-registry/1",
      "release07-calculator-recording/1",
      "release07-incremental-plan/1",
      "release07-isolated-graph/1",
      "release07-real-exercise/1"
    ],
    "release_package": [
      "v5-cleanup-before-after/1",
      "v5-controlled-release-package/1",
      "v5-final-integrity/1",
      "v5-final-quality/1",
      "v5-final-rollback/1",
      "v5-readiness-package-index/1",
      "v5-release-source-lock/1",
      "v5-unresolved-index/1"
    ],
    "evidence": [
      "external-morphology-graph/1"
    ],
    "candidates": [
      "mass-candidate-release/1",
      "mass-registry/1"
    ],
    "review": [
      "review-ledger-v1"
    ],
    "annotation": [
      "preannotation-card/1",
      "preannotation-experiment/1",
      "preannotation-human-plan/1",
      "preannotation-proposal/1",
      "preannotation-report-release/1",
      "preannotation-run/1"
    ],
    "contract": [
      "interal-v5-contract/1",
      "interal-v5-stage/1"
    ],
    "integration": [],
    "supporting": [
      "interal-correspondence-production-integrity/1",
      "mass-proposed-annotation-snapshot/1",
      "mass06-blind-quality-sample/1",
      "mass06-coordinator-resume/1",
      "mass06-cycle/1",
      "mass06-frozen-inputs/1",
      "mass06-proposal-group/1",
      "mass06-quality/1",
      "mass06-review-export/1",
      "v5-morphology-research-archive/1",
      "v5-morphology-statistics/1"
    ]
  },
  "normative": {
    "version": "1.0.0",
    "files": {
      "associativvordes/normative/FAMILY-MEMBERSHIP-POLICY.md": "ed3a4ec5f462b28123fc640a563ee675016e83288b57f6f359087a3be7c8170b",
      "associativvordes/normative/NATIONAL-CORRESPONDENCES.md": "01add47aecee9fafdc820f11bf6e0e14a147a022e9793d686f20a1ae7dce27b0",
      "associativvordes/normative/NORMATIVE-DEFINITIONS.md": "d7467809cb609cc131f67a138812a8e91da1161801e33942baad8a88cfc017e3",
      "associativvordes/normative/README.md": "f247b66f18913ff2aa6e9934cf2b2a8fa9a573305a72649fc0d854e4f68b8ff7",
      "associativvordes/normative/cases.json": "499255c97e285a54f81b1e8197f8954035d1365a8682358009e2e56b75e693a0",
      "associativvordes/normative/decision.schema.json": "a4d30f0c6f1a5488a73191dbe36c8d975e1d50ed074cbc963d18a4a986a19360",
      "associativvordes/normative/national-correspondence.schema.json": "3985d926a95991af801e53e72c4735f370ceb3fed820b918e5b91a6013e194ba",
      "associativvordes/normative/rules.json": "050065577f4ae4387b753d783e5e4760d4406fd5b85c18b15b6243e1b4a2018b",
      "associativvordes/normative/sources.json": "e003653150cd64ed29a7e3149135effe80d7c8a6f584b51fd54e01406b3f1955",
      "associativvordes/normative/validator.mjs": "66c59c6d61f610b1968bd83ac251647da901c6347ae6fa1d4b5d4dd945a41e77"
    }
  },
  "baseline": {
    "version": "v5-baseline-1.0.0",
    "inventory_sha256": "d1c09919569701edc5405969e790ef0769e15e1cbbe67679305040c5b4c9171e",
    "manifest_sha256": "efc61f91632a25f49930fcd284cccdcffb2cf2711f268e21bdcac31d8fddea80",
    "structural_projection_manifest_sha256": "b746c75869c40e2e1ca255298c540942b9d549747867b9ff75860595b2c84ddb",
    "source_commit": "47723611112610945cb09b34e18588b7bd151911"
  },
  "history": {
    "snapshot_sha256": "fe87153c07976f8b4ae02fffee778b5213303cd01d5f8e1f380b08f2d0882374",
    "coverage_complete": false,
    "conflicts": 358,
    "mode": "RESEARCH_ONLY; incomplete coverage blocks every nonempty production operation"
  },
  "sources": {
    "manifest": "data/morphology-evidence/sources/source-lock.json",
    "sha256": "0ca240e9c42334e04ff188d329433b8e476d88a54a80da60d54eca9edaa2bbad"
  },
  "algorithms": {
    "importers": {
      "associativvordes/importers/audit_identity.py": "d4319c335edc6dd14e27056d744d871673a9cfc4c46b1f862cd231704374874f",
      "associativvordes/importers/audit_import.py": "939ef6614114ce710244d0c3024823ae2210cafb2a7100f7e7c6483ad7969c59",
      "associativvordes/importers/audit_scale_index.py": "542ff2ad0dc41859d7ca0cd5789e8a28cc677d70f58ac08308785d215489b318",
      "associativvordes/importers/build_catalog.py": "01fc89f82f5fda595dcd97dea4143a4833bb8638306ff6b26851a9b7bf338530",
      "associativvordes/importers/catalog_store.py": "f69542e963e813498726271d9709f4fdc8920febec66acd99edd57b100116464",
      "associativvordes/importers/certify_corpus.py": "615f0bd1b53d459ca2d0574feaa3e8c55867ff9e3eec2d020e015f7bef7a616e",
      "associativvordes/importers/corpus_cache.py": "35a6b38e1c66f4278fea4ff97046f1655c9f235626120c1db65f06826efc0d1e",
      "associativvordes/importers/fetch_glemm_git.py": "69a567a47624576f82d97cb4388933ef521091faea8bc46b566495c16f04785e",
      "associativvordes/importers/fetch_sources.py": "9b0071ead433cdf68ec7958fbcdfefc2081b1860aff9a4e4d7ebed7f3e1bb7c9",
      "associativvordes/importers/fixtures/source-lock.json": "438ff317f0525379e5a4a95917e1132b176e6b3d21b4646b0b0f371f04fe827a",
      "associativvordes/importers/glemm_cache.py": "6ca02dac909429905739a28d5d32cd1fbf1310dbcfb9e8fc91f09aa5e51693b0",
      "associativvordes/importers/index_watch.py": "ae0d5af9a94a7aaf4db44e19bada5c84a8a452e69c146c181a68115eeab45c2c",
      "associativvordes/importers/morphology_import.py": "2c85307565b595dd2e3d48d76a91d3252403a2cb81d5af11af8a2c6968fbbc3d",
      "associativvordes/importers/rebuild.py": "f2403ff5ed3314a7735a44d3fe12d747d2f9db98f26841cb4a98e7ecfec01037",
      "associativvordes/importers/scale_index.py": "3945564a130cf93d65747cb0293919d1d0d9bdc104e09acb738d74e756d52932",
      "associativvordes/importers/validate_sources.py": "55fe021a19df22bb18f6580bad33491113b78bed29ee3184661d76995d59d96e",
      "associativvordes/importers/verify_replay.py": "7acedac10ad351ba3f96614ffb54eba5f81c5588560f596748f1f8ead3243c37"
    },
    "normative": {
      "associativvordes/normative/cases.json": "499255c97e285a54f81b1e8197f8954035d1365a8682358009e2e56b75e693a0",
      "associativvordes/normative/decision.schema.json": "a4d30f0c6f1a5488a73191dbe36c8d975e1d50ed074cbc963d18a4a986a19360",
      "associativvordes/normative/national-correspondence.schema.json": "3985d926a95991af801e53e72c4735f370ceb3fed820b918e5b91a6013e194ba",
      "associativvordes/normative/rules.json": "050065577f4ae4387b753d783e5e4760d4406fd5b85c18b15b6243e1b4a2018b",
      "associativvordes/normative/sources.json": "e003653150cd64ed29a7e3149135effe80d7c8a6f584b51fd54e01406b3f1955",
      "associativvordes/normative/validator.mjs": "66c59c6d61f610b1968bd83ac251647da901c6347ae6fa1d4b5d4dd945a41e77"
    },
    "baseline": {
      "associativvordes/v5_baseline/audit_ids.py": "022036eeae938a64237de8e8a48d908d49e17a8d705e93363c361973222a7a95",
      "associativvordes/v5_baseline/audit_ledger.py": "b24738ea2e66d6acc2b9bebd4acf231e2765d23daa746d552cdaf29295b8fb16",
      "associativvordes/v5_baseline/audit_metadata.py": "d1077a28746a9a88be78f3cb8c21ee178100621140d6edf70406e8c34b9b174e",